[
  {
    "date": "2024-01-02",
    "open": 185.35,
    "high": 186.00,
    "low": 183.41,
    "close": 184.25,
    "adjusted_close": 184.25,
    "volume": 57471800
  },
  {
    "date": "2024-01-03",
    "open": 182.76,
    "high": 184.26,
    "low": 181.06,
    "close": 182.91,
    "adjusted_close": 182.91,
    "volume": 58440600
  },
  {
    "date": "2024-01-04",
    "open": 182.00,
    "high": 182.97,
    "low": 179.25,
    "close": 181.91,
    "adjusted_close": 181.91,
    "volume": 71983800
  }
]
